{
    "source": "Abdul Latif Jameel Poverty Action Lab Dataverse",
    "source_link": "https://dataverse.harvard.edu/dataset.xhtml?persistentId=doi:10.7910/DVN/19PPE7",
    "timdex_record_id": "jpal:10.7910-DVN-19PPE7",
    "title": "The Impact of Maternal Literacy and Participation Programs: Evidence from a Randomized Evaluation in India",
    "identifiers": [
        {
            "value": "10.7910/DVN/19PPE7",
            "kind": "DOI"
        }
    ]
}